"tweet_id","in_reply_to_status_id","in_reply_to_user_id","retweeted_status_id","retweeted_status_user_id","timestamp","source","text","expanded_urls"
"903395130","","","","","2008-08-29 21:33:36 +0000","<a href=""http://www.chrisfinke.com/addons/twitterbar/"" rel=""nofollow"">TwitterBar</a>","es usted fotero y quiere salir en nat-geo? esta es la suya: http://tinyurl.com/6hck7g"
"903358457","903354113","15209789","","","2008-08-29 20:51:34 +0000","<a href=""http://sourceforge.net/projects/twitux"" rel=""nofollow"">twitux</a>","@bipolarity y eso donde es?? se ve como una enorme dosis de colesterol a la vena XD"
"903236698","","","","","2008-08-29 18:42:12 +0000","<a href=""http://www.chrisfinke.com/addons/twitterbar/"" rel=""nofollow"">TwitterBar</a>","campeonato mundial de improvisaci?n teatral... a ver si ganamos en algo, no?  http://www.mundialimprochile.cl/"
"902888664","902883966","14341531","","","2008-08-29 13:46:02 +0000","<a href=""http://sourceforge.net/projects/twitux"" rel=""nofollow"">twitux</a>","@calup totalmente de acuerdo, el problema es que estaba sucumbiendo demasiado seguido, y el colesterol se dispara :("
"902879722","902875423","10400672","","","2008-08-29 13:37:02 +0000","<a href=""http://sourceforge.net/projects/twitux"" rel=""nofollow"">twitux</a>","@chulini super wena definicion! ir? a pedir eso mismo a vtr al toque"
"902873652","902871061","14341531","","","2008-08-29 13:30:50 +0000","<a href=""http://sourceforge.net/projects/twitux"" rel=""nofollow"">twitux</a>","@calup no estoy gordo por alimentarme mal, estoy gordo por sucumbir a la tentaci?n facilmente XD"
"902873245","902871061","14341531","","","2008-08-29 13:30:25 +0000","<a href=""http://sourceforge.net/projects/twitux"" rel=""nofollow"">twitux</a>","@calup deportes de fin de semana y wii fit cuando tengo tiempo, pero tambien tengo que bajar las dosis de masas, pan y cosas ricas..."
"902864120","902860455","14341531","","","2008-08-29 13:20:58 +0000","<a href=""http://sourceforge.net/projects/twitux"" rel=""nofollow"">twitux</a>","@calup un yoguyogu y barras de cereal, hay una ponchera de homero que reducir antes de ponerse zunga"
"902862490","902860455","14341531","","","2008-08-29 13:19:18 +0000","<a href=""http://sourceforge.net/projects/twitux"" rel=""nofollow"">twitux</a>","@calup guten morguen ;)"
"902861312","902858724","7921362","","","2008-08-29 13:18:09 +0000","<a href=""http://sourceforge.net/projects/twitux"" rel=""nofollow"">twitux</a>","@matiasasun fotos a flickr? si no eres pokemon o no muestras las tetas, olvidate de llenarte de comments XD"
"902859079","","","","","2008-08-29 13:15:47 +0000","<a href=""http://sourceforge.net/projects/twitux"" rel=""nofollow"">twitux</a>","main {printf(""hello world\n""); }"
"902461148","","","","","2008-08-29 03:04:38 +0000","<a href=""http://www.twhirl.org/"" rel=""nofollow"">twhirl</a>","buena hora para quedarse dormido"
"902426507","","","","","2008-08-29 02:37:03 +0000","<a href=""http://www.twhirl.org/"" rel=""nofollow"">twhirl</a>","la lengua b?fida le alterar? la forma de hablar??"
"902424792","902421864","11664832","","","2008-08-29 02:35:34 +0000","<a href=""http://www.twhirl.org/"" rel=""nofollow"">twhirl</a>","@psyclaudita dlorosa la weaita"
"902407026","","","","","2008-08-29 02:19:52 +0000","<a href=""http://www.twhirl.org/"" rel=""nofollow"">twhirl</a>","aqui en vivo me est? dando .... dolooooooooorrr!!!! XD"
"902086968","","","","","2008-08-28 20:32:08 +0000","<a href=""http://www.chrisfinke.com/addons/twitterbar/"" rel=""nofollow"">TwitterBar</a>","hola que tal.... Festival!!!  que rancio! http://tinyurl.com/55tpqk"
"902070903","902060888","6242362","","","2008-08-28 20:16:00 +0000","<a href=""http://sourceforge.net/projects/twitux"" rel=""nofollow"">twitux</a>","@arvaro pucha que lata que te la hayan robado, la ae1 suena exquisito al obturarla, es una delicia..."
"902050997","902027325","6242362","","","2008-08-28 19:54:49 +0000","<a href=""http://sourceforge.net/projects/twitux"" rel=""nofollow"">twitux</a>","@arvaro escoge http://www.flickr.com/photos/kepanuk/2209837056/ ( y ahi faltan de febrero a agosto )"
"902011387","","","","","2008-08-28 19:13:44 +0000","<a href=""http://sourceforge.net/projects/twitux"" rel=""nofollow"">twitux</a>","al almuerzo me dijeron ""que buenas fotos hace tu camara"" a lo que contest? ""que buenos clavos clava tu martillo"" ... hmpf!"
"901801441","","","","","2008-08-28 15:54:11 +0000","<a href=""http://www.chrisfinke.com/addons/twitterbar/"" rel=""nofollow"">TwitterBar</a>","descubriendo el negocio web de @japosai http://www.bragasusadas.com/"
"901720864","","","","","2008-08-28 14:42:14 +0000","<a href=""http://www.chrisfinke.com/addons/twitterbar/"" rel=""nofollow"">TwitterBar</a>","chucha la media cagaita que qued? en el aplicacion! :( http://tinyurl.com/594o8s"
"901717066","901712816","10044232","","","2008-08-28 14:38:38 +0000","<a href=""http://sourceforge.net/projects/twitux"" rel=""nofollow"">twitux</a>","@infozeus que tal tu aterrizaje en tu nuevo puesto?"
"901700625","","","","","2008-08-28 14:23:24 +0000","<a href=""http://sourceforge.net/projects/twitux"" rel=""nofollow"">twitux</a>","@JCorleone prob? algo similar, pero tampoco result? mucho :("
"901699319","901697068","13720992","","","2008-08-28 14:22:12 +0000","<a href=""http://sourceforge.net/projects/twitux"" rel=""nofollow"">twitux</a>","@CatBulsara prob? con mate y unas vitaminas ""mega men"" de gnc... sigo entero desconcentrado, y empeorando"
"901693005","","","","","2008-08-28 14:16:29 +0000","<a href=""http://sourceforge.net/projects/twitux"" rel=""nofollow"">twitux</a>","si uno tiene severos problemas para concentrarse... que debe hacer? meterse en una centrifuga? deshidratarse? convertirse en caldo maggi?"
"901631154","","","","","2008-08-28 13:16:02 +0000","<a href=""http://sourceforge.net/projects/twitux"" rel=""nofollow"">twitux</a>","las calles vistas de las ventanas saltan tantas igual, pateando piedras juntando monedas soy un simple auditor"
"900987968","900987087","11033512","","","2008-08-27 22:05:39 +0000","<a href=""http://sourceforge.net/projects/twitux"" rel=""nofollow"">twitux</a>","@koneja pero la corte acogi? ese escrito? dict? alguna orden de no innovar? no vi nada de eso en las news..."
"900984247","","","","","2008-08-27 22:01:37 +0000","<a href=""http://sourceforge.net/projects/twitux"" rel=""nofollow"">twitux</a>","desaparecio el link de preventa pa madonna en ticketmaster.. se habr?n agotado o iran a reponerlo ma?ana?"
"900975503","","","","","2008-08-27 21:51:50 +0000","<a href=""http://sourceforge.net/projects/twitux"" rel=""nofollow"">twitux</a>","maldita sea!!!!"
"900943193","","","","","2008-08-27 21:15:49 +0000","<a href=""http://www.chrisfinke.com/addons/twitterbar/"" rel=""nofollow"">TwitterBar</a>","quien podria querer esto de wallpaper?? http://tinyurl.com/5vhb5y"
"900910940","","","","","2008-08-27 20:41:19 +0000","<a href=""http://sourceforge.net/projects/twitux"" rel=""nofollow"">twitux</a>","probando microfono con la ayuda de redol?s en http://malditasmaquinas.cl"
"900894526","","","","","2008-08-27 20:23:23 +0000","<a href=""http://www.chrisfinke.com/addons/twitterbar/"" rel=""nofollow"">TwitterBar</a>","cuando paso en la noche, esta vitrina me da sed http://www.flickr.com/photos/kepanuk/2800905405/"
"900802775","","","","","2008-08-27 18:48:50 +0000","<a href=""http://sourceforge.net/projects/twitux"" rel=""nofollow"">twitux</a>","volviendo del lunche y de grabar el programa de esta semana para http://malditasmaquinas.cl"
"900658703","900654622","3040871","","","2008-08-27 16:25:31 +0000","<a href=""http://sourceforge.net/projects/twitux"" rel=""nofollow"">twitux</a>","@RobertoA est? muy chori tu tumblr :)"
"900637388","900634612","8861932","","","2008-08-27 16:06:01 +0000","<a href=""http://sourceforge.net/projects/twitux"" rel=""nofollow"">twitux</a>","@iperich @eduardoe hay que difundir la palabra del fsm! http://www.venganza.org"
"900631804","900629141","8861932","","","2008-08-27 16:00:35 +0000","<a href=""http://sourceforge.net/projects/twitux"" rel=""nofollow"">twitux</a>","@iperich yo empiezo a guardar mis cosas altiro y me dedicar? a vender collares y leer el tarot XD"
"900628402","900627536","10044232","","","2008-08-27 15:57:27 +0000","<a href=""http://sourceforge.net/projects/twitux"" rel=""nofollow"">twitux</a>","@infozeus la gracia de ir a cancha es cuando no hay cancha vip. si hay cancha vip, no se ve nada, quedas lejos y tipico que un gil te tapa"
"900624070","","","","","2008-08-27 15:53:17 +0000","<a href=""http://www.chrisfinke.com/addons/twitterbar/"" rel=""nofollow"">TwitterBar</a>","shu, pedazo de condoro :( http://tinyurl.com/5a5nhz"
"900597896","900594983","81343","","","2008-08-27 15:28:54 +0000","<a href=""http://sourceforge.net/projects/twitux"" rel=""nofollow"">twitux</a>","@jp192 para tu bookmark: http://rickrolldb.com/ ( no, no es rickrolleo, es la lista de paginas con las cuales hacer la gracia )"
"900596514","900594983","81343","","","2008-08-27 15:27:33 +0000","<a href=""http://sourceforge.net/projects/twitux"" rel=""nofollow"">twitux</a>","@jp192 XD sorry"
"900587020","900579694","8861932","","","2008-08-27 15:19:07 +0000","<a href=""http://sourceforge.net/projects/twitux"" rel=""nofollow"">twitux</a>","@iperich si, es caro. sale mejor ver  http://dev.cl/zj4"
"900573778","","","","","2008-08-27 15:07:20 +0000","<a href=""http://www.chrisfinke.com/addons/twitterbar/"" rel=""nofollow"">TwitterBar</a>","el 11 de octubre es el rickrolleo masivo http://tinyurl.com/64cz24"
"900545082","900541236","10044232","","","2008-08-27 14:42:20 +0000","<a href=""http://sourceforge.net/projects/twitux"" rel=""nofollow"">twitux</a>","@infozeus pues exito entonces! ojal? sea un muy buen lugar para trabajar ;)"
"900536077","900529810","10044232","","","2008-08-27 14:34:15 +0000","<a href=""http://sourceforge.net/projects/twitux"" rel=""nofollow"">twitux</a>","@infozeus oh que rudo, y a donde migras?"
"900534747","","","","","2008-08-27 14:32:59 +0000","<a href=""http://www.chrisfinke.com/addons/twitterbar/"" rel=""nofollow"">TwitterBar</a>","ta http://www.lun.com/modulos/catalogo/Paginas/2008/08/24/LCTP10RE2408.HTM"
"900477979","","","","","2008-08-27 13:39:20 +0000","<a href=""http://sourceforge.net/projects/twitux"" rel=""nofollow"">twitux</a>","que molesto es cuando llueve y los conductores se ponen mas weones de lo habitual..."
"900477369","900095337","15832208","","","2008-08-27 13:38:40 +0000","<a href=""http://sourceforge.net/projects/twitux"" rel=""nofollow"">twitux</a>","@Vanimelir gracias por el comment de tus fotos de anoche, solo una precision: yo no le hago al fotoch?, son as-is, muchas analogas incluso"
"900049402","","","","","2008-08-27 02:45:31 +0000","<a href=""http://www.twhirl.org/"" rel=""nofollow"">twhirl</a>","system halted. si est? aburrido y quiere ver fotos, paseese por http://flickr.com/photos/kepanuk"
"900043260","900042739","6433122","","","2008-08-27 02:40:29 +0000","<a href=""http://www.twhirl.org/"" rel=""nofollow"">twhirl</a>","@Curvaspoliticas sorry la demora y el escaso aporte: no cacho na, nunca he desarmado un mac ;)"
"900020033","","","","","2008-08-27 02:19:21 +0000","<a href=""http://www.chrisfinke.com/addons/twitterbar/"" rel=""nofollow"">TwitterBar</a>","se le cay? un vaso? no se preocupe, a ella le fue peor ( cortesia de @stormish ) http://tinyurl.com/6xuq35"
"899998505","","","","","2008-08-27 01:58:44 +0000","<a href=""http://www.twhirl.org/"" rel=""nofollow"">twhirl</a>","ahora si, aviso comercial gratuito porque me gust? mi foto: si va a @cafe_bucca a almorzar,  la sopa es gratis  http://dev.cl/o8"
"899993493","","","","","2008-08-27 01:53:42 +0000","<a href=""http://www.chrisfinke.com/addons/twitterbar/"" rel=""nofollow"">TwitterBar</a>","http://www.flickr.com/photos/kepanuk/"
"899982673","","","","","2008-08-27 01:41:54 +0000","<a href=""http://www.chrisfinke.com/addons/twitterbar/"" rel=""nofollow"">TwitterBar</a>","mish que chori. a ver que sale de esto, pero me tinca interesante http://tinyurl.com/6myneo"
"899961264","899957244","6063182","","","2008-08-27 01:17:01 +0000","<a href=""http://www.twhirl.org/"" rel=""nofollow"">twhirl</a>","@barbaragallardo ah?!!! pondr? el link entonces en la foto :)"
"899955735","","","","","2008-08-27 01:10:38 +0000","<a href=""http://www.chrisfinke.com/addons/twitterbar/"" rel=""nofollow"">TwitterBar</a>","control-Z ud cacha de que se trata esto? yo al menos no cach? na... http://www.flickr.com/photos/kepanuk/2801755102/"
"899953644","899946024","14631847","","","2008-08-27 01:07:57 +0000","<a href=""http://www.twhirl.org/"" rel=""nofollow"">twhirl</a>","@driquelm http://www.flickr.com/photos/kepanuk/2800900871/"
"899937249","899934005","15336599","","","2008-08-27 00:47:55 +0000","<a href=""http://www.twhirl.org/"" rel=""nofollow"">twhirl</a>","@Verlier es en serio, te ayuda a la digestion de las fritangas ;)"
"899931116","899925469","15336599","","","2008-08-27 00:39:52 +0000","<a href=""http://www.twhirl.org/"" rel=""nofollow"">twhirl</a>","@Verlier pero claro, cambia el jugo por cerveza y pasa a ser plenamente recomendable..."
"899925034","","","","","2008-08-27 00:32:20 +0000","<a href=""http://www.twhirl.org/"" rel=""nofollow"">twhirl</a>","subiendo fotos al flickr...."
"899910476","","","","","2008-08-27 00:14:03 +0000","<a href=""http://www.twhirl.org/"" rel=""nofollow"">twhirl</a>","unos peque?os retoques a la curva de color con gimp no son pecado, cierto?"
"899810585","","","","","2008-08-26 22:08:37 +0000","<a href=""http://sourceforge.net/projects/twitux"" rel=""nofollow"">twitux</a>","mis neuronas se botaron a paro. mejor me largo de ac?"
"899688457","899686333","11152012","","","2008-08-26 19:52:18 +0000","<a href=""http://sourceforge.net/projects/twitux"" rel=""nofollow"">twitux</a>","@paulo_saavedra a la antigua: libros, papelografos, juegos..."
"899647327","","","","","2008-08-26 19:08:29 +0000","<a href=""http://sourceforge.net/projects/twitux"" rel=""nofollow"">twitux</a>","me carga tener que andar apretando a la gente pa que haga su pega"
"899626184","899624354","13720992","","","2008-08-26 18:45:27 +0000","<a href=""http://sourceforge.net/projects/twitux"" rel=""nofollow"">twitux</a>","@CatBulsara es una excusa para regalarle plata al pobre steve jobs"
"899469303","","","","","2008-08-26 16:06:54 +0000","<a href=""http://www.chrisfinke.com/addons/twitterbar/"" rel=""nofollow"">TwitterBar</a>","Currently Browsing: http://www.flickr.com/photos/kepanuk/275744302/"
"899463534","","","","","2008-08-26 16:01:36 +0000","<a href=""http://www.chrisfinke.com/addons/twitterbar/"" rel=""nofollow"">TwitterBar</a>","tiene derecho a permanecer callada y estar como ausente... http://www.flickr.com/photos/kepanuk/197272989/"
"899453376","","","","","2008-08-26 15:52:17 +0000","<a href=""http://sourceforge.net/projects/twitux"" rel=""nofollow"">twitux</a>","odio cuando el twitterbar me corta las url"
"899389802","","","","","2008-08-26 14:53:39 +0000","<a href=""http://sourceforge.net/projects/twitux"" rel=""nofollow"">twitux</a>","las 11 ya! cresta que improductiva mi ma?ana"
"898544499","","","","","2008-08-25 19:43:35 +0000","<a href=""http://www.chrisfinke.com/addons/twitterbar/"" rel=""nofollow"">TwitterBar</a>","hola, soy walala y tengo la mala costumbre de autofotografiarme en los ascensores: http://flickr.com/photos/kepanuk/2796700677/"
"898513897","898507679","11689892","","","2008-08-25 19:09:42 +0000","<a href=""http://sourceforge.net/projects/twitux"" rel=""nofollow"">twitux</a>","@sandreli merced/estado. al pobre flayte lo tienen que haber dejado como membrillo por andar weviando"
"898505623","","","","","2008-08-25 19:00:32 +0000","<a href=""http://sourceforge.net/projects/twitux"" rel=""nofollow"">twitux</a>","acabo de ver como la gente se toma en serio eso de ""piteate un flayte"": con una voladora en el pecho lo atajaron :S"
"898252147","","","","","2008-08-25 14:43:47 +0000","<a href=""http://www.chrisfinke.com/addons/twitterbar/"" rel=""nofollow"">TwitterBar</a>","para usar con iphones promiscuos http://www.lun.com/modulos/catalogo/paginas/2008/08/25/LUCPRSO12LU2508.htm"
"898181246","898179739","10044232","","","2008-08-25 13:29:46 +0000","<a href=""http://sourceforge.net/projects/twitux"" rel=""nofollow"">twitux</a>","@infozeus vecino, como est? su sr padre?"
"898164836","","","","","2008-08-25 13:10:45 +0000","<a href=""http://sourceforge.net/projects/twitux"" rel=""nofollow"">twitux</a>","lunes again.... snif"
"895950324","","","","","2008-08-22 21:39:57 +0000","<a href=""http://sourceforge.net/projects/twitux"" rel=""nofollow"">twitux</a>","me llevo mis pegados dedos a otro lado lejos del teclado. buen finde para todos !"
"895905424","895902002","8452712","","","2008-08-22 20:46:11 +0000","<a href=""http://sourceforge.net/projects/twitux"" rel=""nofollow"">twitux</a>","@dgomez claro, tambien sirve... pero una bolsa de minutos es mas barata que los minutos excedidos"
"895899233","895897991","8452712","","","2008-08-22 20:38:39 +0000","<a href=""http://sourceforge.net/projects/twitux"" rel=""nofollow"">twitux</a>","@dgomez compra una bolsa..."
"895872354","","","","","2008-08-22 20:08:09 +0000","<a href=""http://sourceforge.net/projects/twitux"" rel=""nofollow"">twitux</a>","hace una flojera espantosa en esta oficina"
"895860195","895850538","2312091","","","2008-08-22 19:54:42 +0000","<a href=""http://sourceforge.net/projects/twitux"" rel=""nofollow"">twitux</a>","@japosai  Open wap.GetJar.com with your mobile -&gt; Quick Download -&gt; enter Quick Download Code 16003"
"895843984","895842535","2312091","","","2008-08-22 19:35:58 +0000","<a href=""http://sourceforge.net/projects/twitux"" rel=""nofollow"">twitux</a>","@japosai si tu celu tiene java, abiro jittr es la solucion."
"895690523","895687436","15832208","","","2008-08-22 16:48:46 +0000","<a href=""http://sourceforge.net/projects/twitux"" rel=""nofollow"">twitux</a>","@Vanimelir para que me de pantallazo azul cuando me corten? XD"
"895650882","895643639","14341531","","","2008-08-22 16:10:08 +0000","<a href=""http://sourceforge.net/projects/twitux"" rel=""nofollow"">twitux</a>","@calup a mi me gusta ir a almorzar a las pipas, serrano con eleuterio ramirez... comida rica y ambiente de casa de campo... con borrachos tb"
"895649960","895643214","15832208","","","2008-08-22 16:09:17 +0000","<a href=""http://sourceforge.net/projects/twitux"" rel=""nofollow"">twitux</a>","@Vanimelir por ahora soy feliz con mi V3. algo como ese pero que ande mas rapido seria top top"
"895634559","895629921","14341531","","","2008-08-22 15:54:42 +0000","<a href=""http://sourceforge.net/projects/twitux"" rel=""nofollow"">twitux</a>","@calup no soy muy de bares yo, se que en valpo hay buenos lugares pero ando poco jaranero ultimamente"
"895556504","","","","","2008-08-22 14:40:54 +0000","<a href=""http://www.chrisfinke.com/addons/twitterbar/"" rel=""nofollow"">TwitterBar</a>","cuando yo era chico vi tres casos similares que se resolvieron con cadena perpetua: matrimonio http://tinyurl.com/6ptxku"
"895548951","895544934","14341531","","","2008-08-22 14:33:36 +0000","<a href=""http://sourceforge.net/projects/twitux"" rel=""nofollow"">twitux</a>","@calup algo asi como el quitapenas?"
"895538370","895535078","1299471","","","2008-08-22 14:23:03 +0000","<a href=""http://sourceforge.net/projects/twitux"" rel=""nofollow"">twitux</a>","@luisramirez basculante"
"895500479","","","","","2008-08-22 13:45:32 +0000","<a href=""http://www.chrisfinke.com/addons/twitterbar/"" rel=""nofollow"">TwitterBar</a>","no ser? musho lusho? esta bien, todos lo hicimos, pero... campeonato? http://tinyurl.com/69pgh5"
"895492625","","","","","2008-08-22 13:37:22 +0000","<a href=""http://sourceforge.net/projects/twitux"" rel=""nofollow"">twitux</a>","yo NO QUIERO un iphone ... y me parece too much tanto revuelo por un aparato fashion geek"
"895125458","","","","","2008-08-22 03:33:48 +0000","<a href=""http://www.twhirl.org/"" rel=""nofollow"">twhirl</a>","nota mental: si te cae ""la gotita"" en la palma,  no trates de despegarla altiro y usando los dedos de la otra mano..."
"895111898","","","","","2008-08-22 03:16:04 +0000","<a href=""http://www.chrisfinke.com/addons/twitterbar/"" rel=""nofollow"">TwitterBar</a>","vaya concurso que fue a ganar esta loca.... http://www.flickr.com/photos/seraphimc/1338199799/in/photostream/"
"894865363","894864824","14341531","","","2008-08-21 22:02:39 +0000","<a href=""http://sourceforge.net/projects/twitux"" rel=""nofollow"">twitux</a>","@calup ac? gmail me anda, el tuiter anduvo algo idiota :S"
"894849836","894846338","14341531","","","2008-08-21 21:44:31 +0000","<a href=""http://sourceforge.net/projects/twitux"" rel=""nofollow"">twitux</a>","@calup si, est? como entrete esto... me da la idea que es mas comodo que mis live bookmarks de firefox al menos ;)"
"894840635","","","","","2008-08-21 21:33:28 +0000","<a href=""http://www.netvibes.com/subscribe.php?module=Twitter"" rel=""nofollow"">Netvibes</a>","configurando netvibes... pucha el sitio chori"
"894709986","894706722","10858922","","","2008-08-21 19:07:09 +0000","<a href=""http://sourceforge.net/projects/twitux"" rel=""nofollow"">twitux</a>","@cereal_bars smasbros brawl me ha tenido harto entretenido tb ;)"
"894705567","894704313","10858922","","","2008-08-21 19:02:20 +0000","<a href=""http://sourceforge.net/projects/twitux"" rel=""nofollow"">twitux</a>","@cereal_bars raving rabbids ... lo prob? es muy entretenido"
"894658929","","","","","2008-08-21 18:12:08 +0000","<a href=""http://www.chrisfinke.com/addons/twitterbar/"" rel=""nofollow"">TwitterBar</a>","GUAJAJAJAJAJAJA juanelo merece ser enmarcado hoy!!! http://tinyurl.com/55xvb2"
"894584179","","","","","2008-08-21 16:55:31 +0000","<a href=""http://www.chrisfinke.com/addons/twitterbar/"" rel=""nofollow"">TwitterBar</a>","alguien debiera organizar algo as? tambi?n ac?.... http://tinyurl.com/63ahc6"
"894564629","","","","","2008-08-21 16:36:41 +0000","<a href=""http://www.chrisfinke.com/addons/twitterbar/"" rel=""nofollow"">TwitterBar</a>","pucha que es sabio este gallo, y pucha que me sent? identificado http://tinyurl.com/5swd26"
"894537729","","","","","2008-08-21 16:11:13 +0000","<a href=""http://www.chrisfinke.com/addons/twitterbar/"" rel=""nofollow"">TwitterBar</a>","hoy recomendamos: revista literaria de mi amiga ely  y su grupo http://elpunal.blogspot.com/"
"894490155","","","","","2008-08-21 15:27:20 +0000","<a href=""http://sourceforge.net/projects/twitux"" rel=""nofollow"">twitux</a>","recien conect?ndome a la matrix"
"893947956","","","","","2008-08-21 02:25:20 +0000","<a href=""http://www.twhirl.org/"" rel=""nofollow"">twhirl</a>","ah, nuevo post y nueva url :) http://camarantigua.cl"
"893947471","","","","","2008-08-21 02:24:44 +0000","<a href=""http://www.twhirl.org/"" rel=""nofollow"">twhirl</a>","viendo la historia de la fotografia en film and arts"
"893824285","","","","","2008-08-20 23:49:45 +0000","web","que triste es bajar de la nube para meterse en un taco"
"893769595","","","","","2008-08-20 22:39:03 +0000","<a href=""http://sourceforge.net/projects/twitux"" rel=""nofollow"">twitux</a>","se para la maquina. me aburri de producir intangibles por el dia de hoy ( entiendase: solo construyo castillos en el aire )"
"893708773","","","","","2008-08-20 21:27:55 +0000","<a href=""http://www.chrisfinke.com/addons/twitterbar/"" rel=""nofollow"">TwitterBar</a>","aviso comercial: a ud le gusta la cerveza ? mi amigo mauricio hace la mejor artesanal del pais: http://tinyurl.com/5mkh2k"
"893669541","","","","","2008-08-20 20:44:51 +0000","<a href=""http://sourceforge.net/projects/twitux"" rel=""nofollow"">twitux</a>","@bcrra genial, gracias :)"
"893662544","","","","","2008-08-20 20:37:16 +0000","<a href=""http://sourceforge.net/projects/twitux"" rel=""nofollow"">twitux</a>","pronto, en su bajador de podcasts favorito... http://malditasmaquinas.cl"
"893637137","","","","","2008-08-20 20:09:28 +0000","<a href=""http://sourceforge.net/projects/twitux"" rel=""nofollow"">twitux</a>","alguien tiene un buen dato de donde sacar templates choris para wordpress??"
"893625063","893622121","3424771","","","2008-08-20 19:56:43 +0000","<a href=""http://sourceforge.net/projects/twitux"" rel=""nofollow"">twitux</a>","@Gentz oye y por que no publicas su mail para suscribirla a boletines de sexshops  ? XD"
"893606916","","","","","2008-08-20 19:36:38 +0000","<a href=""http://sourceforge.net/projects/twitux"" rel=""nofollow"">twitux</a>","cuando esto resulte mi cabeza tendr? precio"
"893581112","","","","","2008-08-20 19:08:30 +0000","<a href=""http://sourceforge.net/projects/twitux"" rel=""nofollow"">twitux</a>","armando proyectos de esos que te quitan tiempo pero te hacen so?ar"
"893459309","","","","","2008-08-20 17:02:11 +0000","<a href=""http://sourceforge.net/projects/twitux"" rel=""nofollow"">twitux</a>","rumbo a almorzar en @cafe_bucca con @driquelm para grabar el podcast perdido"
"893452761","","","","","2008-08-20 16:56:14 +0000","<a href=""http://sourceforge.net/projects/twitux"" rel=""nofollow"">twitux</a>","esperando que @driquelm de se?ales de vida"
"893340049","","","","","2008-08-20 15:09:40 +0000","<a href=""http://sourceforge.net/projects/twitux"" rel=""nofollow"">twitux</a>","luego de revisar mis cartones del kino dominical, he decidido que esta semana no me volver? millonario asi que trabajar?."
"893321938","","","","","2008-08-20 14:52:43 +0000","<a href=""http://sourceforge.net/projects/twitux"" rel=""nofollow"">twitux</a>","y asi la vida, una amiga menos"
"893301793","","","","","2008-08-20 14:34:23 +0000","<a href=""http://sourceforge.net/projects/twitux"" rel=""nofollow"">twitux</a>","el medio pique del negro bolt..."
"893281497","","","","","2008-08-20 14:15:36 +0000","<a href=""http://sourceforge.net/projects/twitux"" rel=""nofollow"">twitux</a>","alguien cacha a que hora es la carrera de los 200mt?"
