"tweet_id","in_reply_to_status_id","in_reply_to_user_id","retweeted_status_id","retweeted_status_user_id","timestamp","source","text","expanded_urls"
"1172726559","","15336599","","","2009-02-03 12:22:24 +0000","<a href=""http://sourceforge.net/projects/twitux"" rel=""nofollow"">twitux</a>","@Verlier jamas me he enfermado de la guata con jugo de naranja de calle. pero tuve entrenamiento en el casino de buchef, tengo guatebasurero"
"1172710056","","","","","2009-02-03 12:13:27 +0000","<a href=""http://sourceforge.net/projects/twitux"" rel=""nofollow"">twitux</a>","por un chile mas sano: legalicemos a los peruanos que venden jugo de naranja en la calle!"
"1172144422","","","","","2009-02-03 05:41:24 +0000","<a href=""http://twitterfeed.com"" rel=""nofollow"">twitterfeed</a>","hoy en camarantigua: LC-A & LC-A + http://tinyurl.com/dka36g"
"1171379820","","","","","2009-02-02 23:37:26 +0000","<a href=""http://www.twhirl.org/"" rel=""nofollow"">twhirl</a>","hace mucha flojera"
"1171078293","","","","","2009-02-02 21:39:39 +0000","<a href=""http://sourceforge.net/projects/twitux"" rel=""nofollow"">twitux</a>","desconexion inminente. hora de ir a perder pelo"
"1170941652","","3375601","","","2009-02-02 20:49:57 +0000","<a href=""http://sourceforge.net/projects/twitux"" rel=""nofollow"">twitux</a>","@misirlou ya, los paso a un pendrive entonces :)"
"1170883490","","3375601","","","2009-02-02 20:29:00 +0000","<a href=""http://sourceforge.net/projects/twitux"" rel=""nofollow"">twitux</a>","@misirlou oiga veci, los pedazos de la matrix los tengo en deved?. se los paso a dejar?"
"1170858073","","9805652","","","2009-02-02 20:19:48 +0000","<a href=""http://sourceforge.net/projects/twitux"" rel=""nofollow"">twitux</a>","@stormish ya queda poco :)"
"1170856659","","3375601","","","2009-02-02 20:19:17 +0000","<a href=""http://sourceforge.net/projects/twitux"" rel=""nofollow"">twitux</a>","@misirlou perdon perdon, mas no fue mi intencion causar tanta imaginacion"
"1170834317","","3375601","","","2009-02-02 20:11:20 +0000","<a href=""http://sourceforge.net/projects/twitux"" rel=""nofollow"">twitux</a>","@misirlou claro, partiendo por el metro y las micros XD ( a lo mejor  usan los manillares de la bici para otras perversiones desconocidas)"
"1170770075","","","","","2009-02-02 19:48:17 +0000","<a href=""http://twitterfeed.com"" rel=""nofollow"">twitterfeed</a>","recomienda leer: WTFismo: Condones para bicicletas http://snipurl.com/b68u2"
"1170681901","","9805652","","","2009-02-02 19:16:45 +0000","<a href=""http://twitpic.com/"" rel=""nofollow"">TwitPic</a>","@stormish http://twitpic.com/1aw7d - es la failwhale! XD"
"1170662929","","11152012","","","2009-02-02 19:09:39 +0000","<a href=""http://sourceforge.net/projects/twitux"" rel=""nofollow"">twitux</a>","@paulo_saavedra pueden ser ambas"
"1170536414","","9805652","","","2009-02-02 18:23:30 +0000","<a href=""http://twitpic.com/"" rel=""nofollow"">TwitPic</a>","@stormish http://twitpic.com/1avr8 - les toc? nublado el camino o no? ac? est? nublado..."
"1170439132","","","","","2009-02-02 17:48:36 +0000","<a href=""http://twitterfeed.com"" rel=""nofollow"">twitterfeed</a>","recomienda leer: En Febrero Yoga Gratis http://snipurl.com/b61is"
"1170093394","","","","","2009-02-02 15:48:06 +0000","<a href=""http://sourceforge.net/projects/twitux"" rel=""nofollow"">twitux</a>","hora de ir a torturarme"
"1170081811","","","","","2009-02-02 15:44:12 +0000","<a href=""http://twitterfeed.com"" rel=""nofollow"">twitterfeed</a>","recomienda leer: 3 razones porque los empleados no siguen las reglas de seguridad http://snipurl.com/b5ukk"
"1169804112","","14341531","","","2009-02-02 13:58:23 +0000","<a href=""http://sourceforge.net/projects/twitux"" rel=""nofollow"">twitux</a>","@calupi ojal? pase luego, a lo mejor es algun virus angelina jolie dando vueltas XD"
"1169745146","","14341531","","","2009-02-02 13:31:37 +0000","<a href=""http://sourceforge.net/projects/twitux"" rel=""nofollow"">twitux</a>","@calupi bongiorno! :) como va?"
"1169730952","","","","","2009-02-02 13:24:57 +0000","<a href=""http://sourceforge.net/projects/twitux"" rel=""nofollow"">twitux</a>","cuando ser? el bendito dia en que paris.cl tenga pago por internet? que paja ir a la tienda"
"1169681789","","","","","2009-02-02 13:00:21 +0000","<a href=""http://twitterfeed.com"" rel=""nofollow"">twitterfeed</a>","recomienda leer: Self Portraits with Men http://snipurl.com/b5mof"
"1169657851","","","","","2009-02-02 12:47:22 +0000","<a href=""http://sourceforge.net/projects/twitux"" rel=""nofollow"">twitux</a>","grr... como odio que servipag ande ahueonao cuando quiero pagar mis cuentas!"
"1169566208","","","","","2009-02-02 11:54:35 +0000","<a href=""http://twittai.com/"" rel=""nofollow"">twittai</a>","Que paja trabajar en febrero"
"1169545530","","9805652","","","2009-02-02 11:41:41 +0000","<a href=""http://twittai.com/"" rel=""nofollow"">twittai</a>","@stormish buen viajes"
"1168810972","","","","","2009-02-02 03:40:36 +0000","<a href=""http://twitterfeed.com"" rel=""nofollow"">twitterfeed</a>","recomienda leer: Gregg Valentino: Los B?ceps m?s grandes http://snipurl.com/b4y09"
"1168705559","","","","","2009-02-02 03:06:54 +0000","<a href=""http://www.twhirl.org/"" rel=""nofollow"">twhirl</a>","hora de dormir."
"1168664945","","","","","2009-02-02 02:56:18 +0000","<a href=""http://www.twhirl.org/"" rel=""nofollow"">twhirl</a>","@KatheLobos de nada pues!:)"
"1168573495","","","","","2009-02-02 02:28:44 +0000","<a href=""http://twitterfeed.com"" rel=""nofollow"">twitterfeed</a>","ultima foto en flick corriendo peligro http://twurl.nl/8l5gpm"
"1167564888","","","","","2009-02-01 20:00:30 +0000","<a href=""http://twitterfeed.com"" rel=""nofollow"">twitterfeed</a>","ultima foto en flick Rollei 35 S http://twurl.nl/gatz04"
"1167040236","","","","","2009-02-01 15:46:22 +0000","<a href=""http://twitterfeed.com"" rel=""nofollow"">twitterfeed</a>","recomienda leer: Foto confusa http://snipurl.com/b3wii"
"1166081640","","","","","2009-02-01 03:50:12 +0000","<a href=""http://twitterfeed.com"" rel=""nofollow"">twitterfeed</a>","recomienda leer: Cuando la muerte se pasea http://snipurl.com/b35rz"
