"tweet_id","in_reply_to_status_id","in_reply_to_user_id","retweeted_status_id","retweeted_status_user_id","timestamp","source","text","expanded_urls"
"26486753886","","","","","2010-10-05 20:12:49 +0000","<a href=""http://twitterfeed.com"" rel=""nofollow"">twitterfeed</a>","recomienda leer: El fin de la ciencia http://bit.ly/cWkqX1"
"26483777202","","","","","2010-10-05 19:27:37 +0000","<a href=""https://wiki.ubuntu.com/Gwibber"" rel=""nofollow"">Ubuntu</a>","se acuerdan de eso de ""alegria ya viene""?... lleg?, no es lo que esperabamos, pero igual sirve :  http://is.gd/fMyZH"
"26454458073","","","","","2010-10-05 13:08:17 +0000","<a href=""http://twitterfeed.com"" rel=""nofollow"">twitterfeed</a>","recomienda leer: In Case of Emergency for BlackBerry can help save your life http://bit.ly/dqsjoP"
"26451221739","","","","","2010-10-05 12:24:18 +0000","<a href=""http://blackberry.com/twitter"" rel=""nofollow"">Twitter for BlackBerry?</a>","Parece que salir sin chaleco no fue buena idea"
"26437692214","","","","","2010-10-05 07:57:19 +0000","<a href=""http://twitterfeed.com"" rel=""nofollow"">twitterfeed</a>","subi otra foto: puesta de sol http://twurl.nl/2jf46f"
"26426128725","","","","","2010-10-05 03:55:16 +0000","<a href=""http://twitterfeed.com"" rel=""nofollow"">twitterfeed</a>","subi otra foto: aleteo http://twurl.nl/f7f3t2"
"26423998337","26423772930","6433122","","","2010-10-05 03:23:51 +0000","<a href=""https://wiki.ubuntu.com/Gwibber"" rel=""nofollow"">Ubuntu</a>","@Curvaspoliticas algo asi como esto dices tu? http://is.gd/fLfLP"
"26395519587","26394943867","31768061","","","2010-10-04 21:12:18 +0000","<a href=""http://www.echofon.com/"" rel=""nofollow"">Echofon</a>","@Nina_Jipsy claro, ac? est?: http://bit.ly/aiIW9s"
"26393752825","","","","","2010-10-04 20:41:05 +0000","<a href=""http://twitterfeed.com"" rel=""nofollow"">twitterfeed</a>","recomienda leer: A proposito de otro gran maestro. http://bit.ly/91M98d"
"26361205994","","","","","2010-10-04 13:21:32 +0000","<a href=""http://www.echofon.com/"" rel=""nofollow"">Echofon</a>","mi firewall registr? al menos 80 ataques sobre ssh. parece que los jaquels estuvieron entretenidos el fin de semana...."
"26311751120","","","","","2010-10-03 23:34:08 +0000","<a href=""https://wiki.ubuntu.com/Gwibber"" rel=""nofollow"">Ubuntu</a>","un pais que dice querer ser desarrollado deberia de algun modo evitar que los bomberos tengan que andar mendigando en las esquinas"
"26226127260","26225345107","29513176","","","2010-10-03 01:57:29 +0000","<a href=""http://blackberry.com/twitter"" rel=""nofollow"">Twitter for BlackBerry?</a>","@zeva24 en www.netcompra.cl hay un ejemplo de c?lculo de esos costos"
"26124108871","","9805652","","","2010-10-01 23:18:29 +0000","<a href=""http://blackberry.com/twitter"" rel=""nofollow"">Twitter for BlackBerry?</a>","@stormish versus las gyozas http://twitpic.com/2trecq"
"26114717725","","","","","2010-10-01 21:00:20 +0000","<a href=""http://twitterfeed.com"" rel=""nofollow"">twitterfeed</a>","recomienda leer: Bob Borowicz - Fot?grafo del claroscuro. http://bit.ly/9eyKnx"
"26112609573","","","","","2010-10-01 20:28:23 +0000","<a href=""http://www.echofon.com/"" rel=""nofollow"">Echofon</a>","buena idea vespertina: ""salir temprano, caminar, tomar fotos"". mala idea matinal: ""pa que voy a salir con bultos, dejo la camara en la casa"""
"26087329996","","","","","2010-10-01 14:58:24 +0000","<a href=""http://twitterfeed.com"" rel=""nofollow"">twitterfeed</a>","recomienda leer: Stuxnet y el sombr?o 9 de mayo de 1979 http://bit.ly/b61Gx7"
